[
  {
    "id": "E01",
    "title": "Planetary prelude: before there was a local landmass",
    "display_window": "Earth formation, approximately 4.54 billion years ago",
    "central_question": "What is the earliest meaningful starting point for a history of this material territory?",
    "established_in_this_pass": "The Earth-age estimate supplies a planetary frame, not a dated local surface. Keep any origin-of-the-universe prelude optional: the local evidential chain begins with the material and geological history of the planet.",
    "limitations": "No rock from the present territory has been shown in this pass to be as old as Earth. Neither current latitude/longitude nor the present coast can be projected unchanged into planetary formation.",
    "research_tasks": [
      "Explain measurement versus reconstruction and distinguish global context from local evidence.",
      "Document source edition and uncertainty of the Earth-age estimate.",
      "Link the next dossier to actual samples within the scope, rather than describing all world geology as local history."
    ],
    "sources": [
      "S001"
    ],
    "annual_span": null,
    "kind": "prehistory_and_deep_time"
  },
  {
    "id": "E02",
    "title": "Ancient crust: sample histories, not the age of a state",
    "display_window": "Precambrian; local numerical boundaries pending specialist review",
    "central_question": "Which minerals and rocks now within the territory preserve the earliest dated processes?",
    "established_in_this_pass": "The Trivandrum Block paper and the later peninsular-crust paper are relevant starting points. They require sample-by-sample interpretation; the 2006 paper has an erratum whose contents remain unread.",
    "limitations": "An inherited zircon core, a crystallization age, a metamorphic overgrowth and a model crust-extraction age answer different questions. None alone dates a continuously exposed geographical landmass. Do not publish an oldest-rock ranking from an article title.",
    "research_tasks": [
      "Retrieve S002 together with S003 and register every correction.",
      "Build a sample table: locality, coordinates with access restrictions, mineral, analytical spot, method, uncertainty, interpretation and laboratory provenance.",
      "Check S006 full text and later responses; distinguish Hadean ancestry claims from intact-rock formation.",
      "Keep samples outside the scope as geological context, not local finds."
    ],
    "sources": [
      "S002",
      "S003",
      "S006"
    ],
    "annual_span": null,
    "kind": "prehistory_and_deep_time"
  },
  {
    "id": "E03",
    "title": "Metamorphism and the assembly of Gondwana",
    "display_window": "Late Precambrian–early Palaeozoic research frame; not a local calendar",
    "central_question": "How did the blocks that now underlie the territory become connected and transformed?",
    "established_in_this_pass": "The studied southern block preserves evidence interpreted in relation to Gondwana assembly. The record concerns high-temperature processes and mineral histories, not the current coastline.",
    "limitations": "Assembly and breakup are separate episodes. Do not make one age apply to every block, and do not adopt apparent ages from the 2006 abstract before checking its erratum.",
    "research_tasks": [
      "Map terranes, shear zones and sample relations using attributable geological mapping.",
      "Compare competing reconstructions and identify the measurement supporting each linkage.",
      "Separate dated metamorphism from inferred plate configuration.",
      "Record reconstruction model version and uncertainty; a moving-rock reconstruction is not a fixed present-day polygon."
    ],
    "sources": [
      "S002",
      "S003",
      "S006"
    ],
    "annual_span": null,
    "kind": "prehistory_and_deep_time"
  },
  {
    "id": "E04",
    "title": "Continental separation and the western margin",
    "display_window": "Mesozoic–early Cenozoic research frame; chronology to be resolved by process",
    "central_question": "Which rifting, separation and magmatic episodes affected the ancestors of today’s territory?",
    "established_in_this_pass": "The west-coast tectono-magmatic paper is relevant to a multi-stage margin history. It does not justify treating the western margin, Ghats and present beach as one simultaneous creation.",
    "limitations": "The earlier outline’s 250-million-year division was editorial, not a dated local event. Exact India–Madagascar separation and later spreading ages have not been verified in this seed.",
    "research_tasks": [
      "Retrieve regional plate-kinematic and geochronological studies.",
      "Record separate dates for rift initiation, final separation, seafloor spreading, volcanism and later deformation.",
      "Mark adjacent offshore observations as explanatory context.",
      "Avoid assigning modern continental outlines to all palaeogeographic maps."
    ],
    "sources": [
      "S004",
      "S005"
    ],
    "annual_span": null,
    "kind": "prehistory_and_deep_time"
  },
  {
    "id": "E05",
    "title": "Western Ghats: uplift, erosion and drainage",
    "display_window": "Long-duration, overlapping geological processes",
    "central_question": "How did relief and drainage evolve, and which observations discriminate among explanations?",
    "established_in_this_pass": "Offshore sedimentation has been used to investigate erosion and the development of the western Indian margin. The cited Basin Research article is a 2008 publication.",
    "limitations": "No single mountain-range birthday is established. Rock age, surface age, uplift, incision and exhumation cannot be interchanged. A basin-wide inference is not automatically evidence for every local river.",
    "research_tasks": [
      "Review thermochronology, erosion histories, geomorphology and dated sediment provenance together.",
      "Create separate records for measurements and the authors’ interpretations.",
      "Map evidence density by watershed; retain disagreements between models.",
      "Build a palaeoclimate and monsoon source list before asserting a detailed climatic chronology."
    ],
    "sources": [
      "S004",
      "S005"
    ],
    "annual_span": null,
    "kind": "prehistory_and_deep_time"
  },
  {
    "id": "E06",
    "title": "Cenozoic sediments and past life",
    "display_window": "Cenozoic; a checked local example is approximately 17 million years ago",
    "central_question": "What organisms and environments are preserved in the sedimentary record of the territory?",
    "established_in_this_pass": "A study of Quilon Formation molluscan material reports a preferred depositional estimate of 17.08–17.13 Ma. A separate fish-otolith study provides a route into palaeobiological evidence.",
    "limitations": "The reported range is not labelled here as a confidence interval. It dates sampled strata as interpreted by the authors, not the entire coastal plain. The otolith paper has different online and volume publication years.",
    "research_tasks": [
      "Obtain sample tables, fossil localities, analytical methods and stratigraphic logs.",
      "Track taxonomic revisions with stable specimen identifiers and museum repositories.",
      "Distinguish fossil occurrence, depositional environment and inferred climate.",
      "Keep scientific publication dates in the history-of-research index, not the deep-time column."
    ],
    "sources": [
      "S007",
      "S008"
    ],
    "annual_span": null,
    "kind": "prehistory_and_deep_time"
  },
  {
    "id": "E07",
    "title": "Quaternary landscapes, sea levels and environments",
    "display_window": "Quaternary–Holocene; modern processes continue",
    "central_question": "How did shorelines, wetlands, rivers and habitats change before and during human occupation?",
    "established_in_this_pass": "The repository has not yet assembled a critically reviewed local sea-level or palaeoenvironmental series. This is an explicitly open dossier, not a filled gap.",
    "limitations": "The present beach, backwaters and river mouths must not be treated as stationary. A single flood story is not a complete coastal history. Do not give unsourced dates to the birth of a lagoon or the destruction of a port.",
    "research_tasks": [
      "Inventory dated cores, pollen, charcoal, sedimentary facies and geomorphological studies.",
      "Separate global sea-level context from measured local relative sea level.",
      "Record reservoir corrections, sediment reworking and age-depth model uncertainty.",
      "Retrieve a versioned chronostratigraphic chart before importing formal numerical boundaries.",
      "Cross-link later flood accounts to independent sedimentary evidence without presuming agreement."
    ],
    "sources": [
      "S025",
      "S042"
    ],
    "annual_span": null,
    "kind": "prehistory_and_deep_time"
  },
  {
    "id": "E08",
    "title": "Earliest reported hominin presence",
    "display_window": "Lower Palaeolithic attribution reported; absolute local onset unresolved",
    "central_question": "What is the earliest securely contextualized evidence for hominin activity inside the scope?",
    "established_in_this_pass": "The 2016 north-Kerala study’s accessible abstract suggests occupation from the Lower Palaeolithic. It is a research lead beyond the Edakkal rock-art discussion.",
    "limitations": "The full report and a secure earliest absolute date were not obtained. Typological classification is not a calendar date. The presence of stone tools does not on its own identify their makers as Homo sapiens.",
    "research_tasks": [
      "Retrieve the complete report and all cited earlier field studies.",
      "Distinguish excavated stratified finds from surface and redeposited finds.",
      "Record raw material, typology, depositional context, geochronology and site condition.",